answers,date,tags,title,user,votes
2,2013-07-19T14:40:00,"Biblical Basis,Sin,Sanctification,Methodist,Holiness Movement",What is the basis for the belief by some groups that a Christian can live a sinless life?,Narnian,14
4,2013-07-22T13:20:00,"Soteriology,Homosexuality",Do Christian groups which think homosexuality is a sin think you can be a practicing homosexual and also a Christian?,wax eagle,14
1,2013-07-25T07:25:00,"Catholicism,Holy Water",What is Holy Water in Catholicism?,Mawia,14
16,2011-09-03T02:19:00,"Nature Of God,Creation",What are the main views on who created God?,Nicole,14
4,2013-09-02T11:16:00,"Exegesis,Satan,Ephesians",Why is Satan called the prince of the power of the air?,Martin,14
2,2013-09-12T22:57:00,"Catholicism,Atheism,Conscience,Pope Francis",Do Pope Francis' recent comments on atheism represent a change in doctrine?,pterandon,14
4,2013-09-24T17:46:00,"New Testament,Early Church,Acts",What were the early Christians officially persecuted for?,brilliant,14
2,2013-10-03T18:27:00,"Catholicism,Church History,Papacy,Medieval Church",Were the medieval popes examined on a toilet-lid-like chair to establish their masculinity?,Elberich Schneider,14
7,2013-07-04T05:53:00,"Protestantism,Exegesis,Authority","In Protestant churches, who is the authority in interpreting the Bible?",user4998,14
4,2013-07-15T13:38:00,"History,Mosaic Law,Daniel",Why did Daniel consider the allotment of food and wine to be wrong for him to eat?,Narnian,14
2,2013-05-03T09:25:00,"History,Early Church,Liturgy,Oriental Orthodox",Why didn't Syriac Christianity keep Aramaic as their liturgical language?,deathlock,14
1,2013-05-19T16:50:00,"Money,Judas Iscariot",How much were the 30 pieces of silver (Judas's payment) worth?,vsz,14
1,2013-05-20T18:48:00,Trinity,Who compared the Trinity to a triangle with three right angles?,James T,14
6,2013-05-27T04:41:00,"New Testament,Early Church,Temple,Authorship",Which NT books were written after the destruction of the temple?,Jas 3.1,14
4,2013-05-31T16:06:00,"Bible,Bible Translation,Translation",Criteria for translation,Webmaster,14
6,2013-04-19T03:03:00,"Catholicism,Religious Practice,Mass,Language,Latin",Is Latin considered a holy language in the Catholic Church?,Greg,14
5,2011-09-01T07:49:00,"Catholicism,Church History,Reformation,Canonization,Thomas More",Why was Thomas More canonized?,,14
6,2013-06-05T20:52:00,"Paul Apostle,Acts,Circumcision,Galatians",Is it hypocritical for Paul to circumcise Timothy in Act 16:3?,aceinthehole,14
5,2013-06-11T02:42:00,"Exegesis,Mosaic Law,Law And Gospel,Word Study,Eternity","When the Bible says ""forever,"" how can we tell it really means forever?",Steve,14
6,2013-06-16T06:40:00,"Trinity,Worship","What does it mean to ""worship God"" to Christians in general?",Gulshan,14
1,2013-06-22T12:54:00,"Catholicism,Marriage,Church History,Women,Priests",What happened to the wives of priests when celibacy was first instituted in the Catholic church?,Mike,14
4,2013-07-01T11:35:00,"Life Of Jesus,Gospels",Why are the Gospels silent on the physical appearance of Jesus?,Mawia,14
2,2013-07-03T03:23:00,Speaking In Tongues,Are there Christian groups that speak in tongues but as a policy require translation of the God-given language?,pterandon,14
3,2013-03-25T18:32:00,"Exegesis,Protestantism,Gospels,Life Of Jesus,Transfiguration","According to Protestantism, what is the significance of Jesus and the Mount of Transfiguration?",Narnian,14
2,2011-08-31T22:41:00,"Bible,Exegesis",What does it mean to comment on scripture with scripture?,Caleb,14
5,2013-04-02T04:55:00,"Textual Discrepancies,Genealogy","When 1 Timothy cautions against ""endless geneologies"", is it talking about the Bible?",Alypius,14
6,2013-04-06T09:33:00,"Catholicism,Bible Translation",Where does the Catholic church procure most of its Bibles?,Caleb,14
1,2011-08-23T23:23:00,Marriage,What are the differences between the roles of husband and wife in a Christian marriage?,Steve Moser,14
2,2013-04-10T20:56:00,"Life Of Jesus,History,Genesis,Gospel Of John,Time",Reason for drawing water at unusual time,Phonics The Hedgehog,14
5,2013-04-14T06:40:00,"Catholicism,Protestantism,Original Sin,Comparative Christianity",Why is the word ‘concupiscence’ so important in understanding the difference between a Catholic view and a Protestant view of ‘Original Sin’?,Mike,14
2,2013-04-17T04:10:00,"Nature Of God,Trinity,Christology,Hypostatic Union,Time",How does Christ's hypostatic union affect the temporal nature of the Trinity?,El'endia Starman,14
4,2011-08-31T12:03:00,"Biblical Basis,Morality",How do we get morals?,CiscoIPPhone,14
1,2013-02-02T16:29:00,"Kjv,Textual Criticism,Niv",Why are some verses missing in the NIV?,Xoltic,14
1,2013-02-12T16:31:00,"Catholicism,Papacy",How can a Pope be chosen from outside the conclave?,James T,14
5,2013-02-25T14:42:00,"Nature Of God,Christology,Jehovahs Witnesses",From where do Jehovah's Witnesses derive the doctrine that Jesus was and now is Michael the Archangel?,Narnian,14
6,2011-08-31T17:26:00,Creation,Did God create darkness?,Phonics The Hedgehog,14
3,2013-03-07T15:27:00,"Life Of Jesus,Miracles,Missions,Messianic Secret",Why did Jesus not want people to talk about his healing?,SSumner,14
2,2013-03-17T04:50:00,"Catholicism,Papacy,Heresy,Papal Name",Why would popes choose the name Pelagius in light of the Pelagian heresy?,Peter Turner,14
4,2011-08-31T03:49:00,"Biblical Basis,Nature Of Man,Demons",Does the Bible say anything about what demons *are*?,El'endia Starman,14
4,2011-08-31T09:27:00,"History,David",Where did Goliath come from?,Flimzy,14
9,2012-10-29T15:44:00,"Exegesis,Gospel Of Luke,Parables,Literary Criticism","What about the story of the ""Rich Man and Lazarus"" indicates whether it is a parable or not?",warren,14
7,2012-11-08T12:23:00,Terminology,"In what different ways is the word ""cult"" used as a label inside Christianity?",Caleb,14
4,2012-11-22T12:37:00,"Gospel Of Matthew,Resurrection,Elijah,Reincarnation,Malachi",Isn't reincarnation affirmed by the Bible?,Martin,14
2,2012-11-28T13:22:00,"Catholicism,Confession","Do Priests, Cardinals, and Popes have a confessional to which they themselves can/should/must go?",Narnian,14
4,2012-12-06T16:59:00,"Pneumatology,Angels,Demons,Names Of God,Spiritual Warfare",To what extent does mainstream Christian doctrine teach that knowing a spirit's name gives you power over it?,Anixx,14
4,2012-12-19T16:22:00,"Life Of Jesus,Israel,Messiah,Archetype","Is the nation of Israel itself a type of Christ and, if so, how?",Narnian,14
1,2011-08-30T23:38:00,"Biblical Basis,Inerrancy",What is the basis for the doctrine of Biblical inerrancy?,warren,14
10,2011-08-30T12:59:00,"Exegesis,Gospel Of Matthew","What does ""gates of hell"" mean in Matthew 16:18?",Flimzy,14
8,2012-10-24T05:28:00,"Catholicism,Nature Of God,Satan,Adam And Eve,Deception",Does God lie? And does the devil tell the truth?,Xitcod13,14
6,2012-12-20T22:25:00,"Exegesis,Textual Discrepancies,Women,1 Corinthians",How can women be forbidden to speak and yet prophesy and speak in tongues?,aceinthehole,14
3,2013-01-10T04:44:00,"Denomination Survey,Alcohol",On what basis do some denominations prohibit Christians from drinking alcohol?,Greg,14
3,2013-01-13T21:13:00,"Protestantism,Christian Living,Ten Commandments,Sabbath",How do Protestants keep the Sabbath?,Ben Mordecai,14
3,2013-01-14T02:31:00,"Bible,Life Of Jesus,Exegesis,Gospels,Gospel Of Matthew","What is meant by ""Get behind me Satan""?",bn.,14
5,2024-11-21T16:48:00,"Catholicism,Virgin Mary,Atonement,Mariology,Immaculate Conception","In Catholic atonement theology, if God can save Mary from all sin without Christ, what was the point of Christ's death?",babbott,14
3,2024-11-25T11:48:00,"Apologetics,Comparative Christianity,Epistemology,Truth,Skepticism","If every denomination is skeptical of every other denomination, why shouldn't non-Christian outside observers be skeptical of all denominations?",,14
7,2023-06-03T16:09:00,"Science,Intelligent Design","Do Christian proponents of Intelligent Design hold it to be a scientific position, and if not, do they see this lack of scientific rigor as an issue?",,13
2,2012-09-09T09:28:00,"History,Reformed Theology,Creeds And Confessions","According to reformed theology, why are certain important doctrines not ""obvious""? [i.e. why does the Westminister Confession even exist?]",unregistered-matthew7.7,13
3,2012-09-19T12:58:00,Miracles,Why are we not seeing miracles in our lives?,Paddington,13
1,2012-09-24T01:04:00,"Culture,Jesus Christ Superstar",Was anyone making a theological point by changing the ending of Jesus Christ Superstar?,Affable Geek,13
4,2011-08-23T21:38:00,Baptism,What is the significance of Jesus' baptism for a theology of baptism?,gmoothart,13
4,2012-10-06T20:26:00,"Lds,Church Structure",What would happen to somebody voting in opposition to a proposition at LDS General Conference?,Caleb,14
5,2011-08-29T15:47:00,"Sin,Ten Commandments",How should a Christian evaluate whether a particular action a sin or not?,Caleb,14
4,2012-10-09T13:11:00,"Exegesis,Paul Apostle,1 Corinthians,Inspiration",Is 1 Corinthians 7:26–40 not the 'Word of God'?,byronyasgur,14
2,2011-08-27T22:37:00,History,What is a Nazirite?,Phonics The Hedgehog,13
2,2012-08-02T16:06:00,"Nature Of God,Trinity,Nature Of Man,Trichotomism,Dichotomism",Overview of Trichotomous vs Dichotomous views of Man,warren,13
4,2022-03-18T12:53:00,"History,John The Baptist",How long had John the Baptist been preaching before Jesus started his public ministry?,,13
4,2012-08-09T12:01:00,"Exegesis,Gospel Of Matthew,Faith,Peter,Greek",When Jesus gave Peter his name (rock) what is the significance that he then said upon a ‘different’ kind of rock he would build his church?,Mike,13
8,2024-05-30T08:33:00,"Paul Apostle,Judaism,Acts,Apostles,Conversion",Did Paul remain a Jew even after his conversion?,Mithridates the Great,14
7,2021-07-07T06:13:00,"Lds,Apologetics,Book Of Mormon,Inspiration,Supernatural","According to Latter-day Saints, what are the strongest apologetic arguments for the divine inspiration of the Book of Mormon?",,13
3,2021-07-14T19:14:00,"Protestantism,Apologetics,Intercession Of Saints,Logic","According to Protestantism, what are the strongest apologetic arguments against the doctrine of Intercession of Saints?",,13
8,2021-10-31T01:48:00,"Catholicism,Communion,Blasphemy",According to the Catholic Church is it offensive to dress as a Catholic priest and perform “communion”?,mweiss,13
2,2012-07-30T14:29:00,"Catholicism,Eastern Orthodox",Is Roman Catholic reconciliation with the Orthodox likely (or possible)?,Ignatius Theophorus,13
10,2012-07-31T16:07:00,"Life Of Jesus,Sacrifice,Messiah,Atonement","What does it mean to say ""Jesus died for our sins""?",RandomDuck.NET,13
2,2019-12-22T01:30:00,"Amish,Ordinances",Do Amish have fire alarms?,CStafford-14,13
2,2011-08-26T21:42:00,Terminology,Can Christianity be objectively defined?,Jeff,13
11,2012-05-04T17:08:00,"Paul Apostle,Apostles",Who was the 12th Apostle - Matthias or Paul?,Affable Geek,13
2,2020-01-16T07:35:00,"Marriage,Papacy,Celibacy",Last married pope?,David Woitkowski,13
3,2020-02-14T13:48:00,"Gospel Of Luke,Authorship",When Was The Gospel of Luke Written?,JRosebrookMaye,13
6,2012-05-08T01:00:00,"Biblical Basis,Baptism,Sacraments",Which Bible verses support adult-only baptism?,Nate Bunney,13
1,2011-08-26T23:27:00,"Prayer,Intercession","What is ""intercession"" and what kinds of ""intercessory prayer"" are there?",Caleb,13
7,2012-06-28T11:22:00,"Original Sin,Ezekiel,Original Guilt",Inheritance of original sin,Marc Gravell,13
8,2021-06-17T09:32:00,"Church History,Evangelicalism,Science",Is there a theological basis for climate change skepticism among evangelicals?,Mr. Boy,13
6,2012-07-06T17:10:00,"Life Of Jesus,Heaven,Ascension,Resurrection Body,Resurrection Of Jesus",Was Jesus' resurrected body the same as his glorified body that he now has in heaven?,Mike,13
3,2012-04-17T16:25:00,"History,Prophecy,Apologetics",Biblical Prophecy and Fulfillment,San Jacinto,13
1,2019-10-12T01:20:00,"Reference Request,Martin Luther",Source for this alleged quote from Martin Luther?,Nathan Osman,13
1,2018-07-27T12:19:00,"Catholicism,Sacramentals,Holy Water",How much can holy water be diluted?,Bartek Banachewicz,13
5,2012-03-13T23:47:00,Creation,Why did God create man?,Greg McNulty,13
3,2018-12-12T21:13:00,"Catholicism,Faith,Philosophy,Epistemology,General Revelation","What is the ""fideism"" rejected by the Catholic Church?",Nathaniel is protesting,13
3,2019-01-01T21:04:00,"Catholicism,Virgin Mary,Original Sin,Immaculate Conception","If God could make Mary sinless, why not anybody else?",Seamus,13
4,2012-02-27T07:21:00,"Exegesis,Genesis",What does it mean that someone managed to live beyond 120 years?,El'endia Starman,13
1,2018-04-17T16:25:00,"Catholicism,Gospel Of John",What does Catholic Church say about the post-resurrection wound marks of Jesus?,Kadalikatt Joseph Sibichan,13
3,2018-06-04T03:42:00,"China,Three Self Patriotic Movement,China,Three Self Patriotic Movement",What theological differences distinguish the Three-Self Patriotic Movement and the house church movement in China?,Susan,13
6,2012-03-24T23:31:00,"Free Will,Predestination",Can you explain this Free Will / Predestination illustration?,Brian Koser,13
1,2012-03-27T01:16:00,"Sin,Church History",How did the Seven Deadly Sins originate and how is it used?,Affable Geek,13
3,2011-08-26T14:24:00,"Catholicism,Communion,Sacraments",Why did Jesus use bread to turn into His body?,DForck42,13
3,2011-08-26T14:46:00,"Sin,Sexuality",What does the Bible say about sex before marriage / premarital sex?,capitalaudience.com,13
5,2012-04-02T15:38:00,"Life Of Jesus,Soteriology,Easter,Passover",How does the Passover foreshadow the coming of Jesus as the Messiah?,Narnian,13
1,2011-08-26T17:42:00,"History,Lds,Prophecy",Does Joseph Smith fail the test of a prophet?,capitalaudience.com,13
2,2017-08-08T11:47:00,"Catholicism,Church History,Papacy,Medieval Church",What role do the people of Rome play in the election of a pope?,Nathaniel is protesting,13
6,2012-02-08T14:36:00,"Exegesis,Gospel Of John,Passion Of Jesus,Truth,Pilate","What did Pilate mean by asking ""What is truth?""",Affable Geek,13
1,2017-08-28T06:19:00,"Exegesis,Life Of Jesus,Gospel Of John,Mosaic Law,Pharisees","Was the near-stoning of the adulterous woman something to be considered common practice, or was it strictly to trick Jesus?",ServantoftheKing,13
8,2017-09-28T12:02:00,"Old Testament,New Testament,Demons,Prophets,Exorcism",Was casting out of demons done in the Old Testament by any Prophets or was it started in the New Testament?,Admire Shams,13
6,2012-02-14T06:07:00,"Catholicism,Bible Translation,Presbyterianism,Lords Prayer",Debtors vs. Trespassers,geoffmpm,13
1,2012-02-15T18:06:00,"Life Of Jesus,Baptism,Law And Gospel",What is God's good news before Jesus's death and resurrection?,Brandon Linton,13
6,2012-02-21T13:16:00,"Genesis,Chronology,Archaeology",How we do we know that Joseph wasn't Hyksos?,Affable Geek,13
4,2011-08-25T18:08:00,"Exegesis,Book Of James,Jeremiah,Boasting,Pride",Are pride and boasting ever okay?,a_hardin,13
3,2012-01-24T22:12:00,"Inspiration,Special Revelation",Who believes in Mechanical Inspiration?,Caleb,13
4,2012-01-26T11:17:00,Paul Apostle,How many languages did apostle Paul speak?,brilliant,13
2,2012-01-31T01:44:00,"Chronology,Prophets,Jonah,Nahum",What is the ordering of events in Nahum and Jonah?,Brian Mains,13
2,2017-07-05T15:31:00,"Church History,Early Church,Religious Practice,Fasting,Didache",Who are the hypocrites associated with fasting in the Didache?,mi name,13
8,2011-08-25T19:33:00,"Exegesis,1 Corinthians,Spiritual Gifts,Speaking In Tongues,Signs",Are tongues a sign for believers or unbelievers?,Reinstate Monica - Goodbye SE,13
4,2018-01-27T17:13:00,"Canon,Sola Scriptura,Westminster Confession",How does the Westminster Confession address the paradox of the Bible canon?,guest37,13
2,2018-02-22T17:17:00,"Lds,Creeds And Confessions,Non Trinitarian,Apostles Creed","What problems, if any, do Mormons have with the Apostles' Creed?",Nathaniel is protesting,13
5,2012-01-22T22:08:00,"Biblical Basis,Trinity,Pneumatology",What is the Biblical basis for the Holy Spirit being God?,Affable Geek,13
4,2012-01-24T03:01:00,"Catholicism,Sexuality,Song Of Songs",How does a Roman Catholic reconcile a preference for purely procreative sex with the Song of Solomon?,Affable Geek,13
1,2012-01-06T23:06:00,"Catholicism,Priesthood,Universal Priesthood",How does the Catholic Church understand the priesthood of all believers?,Jon Ericson,13
3,2012-01-09T18:35:00,"Biblical Basis,Nature Of God,Divine Simplicity",What is the Biblical basis for divine simplicity?,OnesimusUnbound,13
5,2011-08-25T16:24:00,"Catholicism,Communion,Real Presence",What do Catholics mean when they talk about the Real Presence in the Eucharist?,Bruce Alderman,13
4,2017-01-02T09:12:00,"Old Testament,Prophecy,Messiah",What is the biblical basis in the Old Testament for the belief that the Messiah must be God?,Kyoma,13
2,2017-01-03T09:23:00,"Nature Of Man,Morality,Theistic Evolution",How do theistic evolutionists explain moral reasoning?,DryLabRebel,13
5,2017-01-08T04:08:00,"Lds,Book Of Mormon,Translation,Joseph Smith","Why did Joseph Smith translate the Book of Mormon into Jacobean English, not in use in 1830?",Abstraction is everything.,13
4,2016-08-15T18:26:00,"History,Acts,Authorship",What are the arguments that Acts was written prior to 70 AD?,Cannabijoy,13
3,2016-09-05T15:21:00,"Catholicism,Eastern Orthodox,Saint,Canonization",Who is the most recent saint recognized by both the Catholic and the Orthodox churches?,Psychonaut,13
6,2017-01-10T01:14:00,"Life Of Jesus,Islam","Is there a Christian equivalent of the Muslim hadith, but for narrations relating to Jesus?",Rebecca J. Stones,13
8,2017-01-11T20:22:00,"Biblical Basis,Free Will,Libertarian Free Will",What is the biblical basis for libertarian free will (no predestination)?,Tavrock,13
5,2017-01-23T06:34:00,"Soteriology,Sola Fide,Justification,Repentance,Assurance Of Salvation","How does repentance fit into the doctrine of sola fide (""by faith alone"")?",Thunderforge,13
3,2017-01-27T03:05:00,"Eastern Orthodox,Scriptures,Greek,Language,Biblical Languages",What version of the bible do Greek speaking Christians use?,TheIronKnuckle,13
4,2017-02-08T20:48:00,"Nature Of God,Trinity,Persons Of The Trinity,Divine Simplicity",How is the Trinity compatible with divine simplicity?,TheIronKnuckle,13
4,2011-12-28T05:02:00,"Biblical Basis,Creation,Young Earth Creation",Is the age of the earth in the Bible?,Tyler,13
5,2011-12-31T05:57:00,"Tradition,Burial",Why are people traditionally buried facing east?,Gabriel Fair,13
6,2012-01-03T16:28:00,"Biblical Basis,Nature Of God,Hell,Omniprescence",Does God's omnipresence extend to hell?,Affable Geek,13
2,2016-08-09T09:12:00,"Soteriology,Trinity,Reformed Theology,Hell",According to Reformed Theology do non-trinitarians go to hell?,Cannabijoy,13
2,2011-11-26T21:24:00,"Catholicism,Mariology,Intercession Of Saints,Mediator",How is 1 Timothy 2:5 interpreted relative to the Mediatrix concept?,StackExchange saddens dancek,13
5,2016-03-23T23:20:00,"Origin,Adam And Eve,Fall Of Man",Adam and Eve Clothed in Light Before the Fall - Origin of this belief?,,13
2,2016-03-25T04:36:00,"Bible Translation,Kjv,Kjv Onlyism",How does King James-only-ism apply to other languages?,,13
1,2016-05-14T09:33:00,"Exegesis,Genesis,Acts,Pentecost,Babel",Who first described Pentecost as a reversal of Babel?,bruised reed,13
2,2016-05-23T23:27:00,"Church Fathers,Numerology","Did any early church fathers, other than Augustine, condemn or write about numerology?",M47145,13
4,2011-12-15T04:50:00,"Bible,Wisdom,Non Christians",Can the Word of God and God's wisdom be beneficial to an unbeliever?,Nick Rolando,13
5,2016-06-12T19:52:00,"Catholicism,Thomas Aquinas,Summa Theologica",Are Catholics required to accept every article of Aquinas's «Summa Theologica»?,Jin-Dominique,13
5,2016-06-13T15:38:00,"Catholicism,Tradition,Liturgy,Mass,Sign Of The Cross",Why do Catholic laity cross themselves three times before the Gospel is read?,Peter Turner,13
3,2016-07-05T20:24:00,"Reformed Theology,Religious Practice,Worship,Hymns,Calvin",Did John Calvin discourage harmonies in congregational singing?,Nathaniel is protesting,13
4,2016-07-31T12:27:00,"Apologetics,Textual Criticism,Bart Ehrman",How do apologists defend against Bart Ehrman's arguments that Church scribes corrected and changed the Bible to fit their theology?,Aaron Johnson,13
4,2011-12-27T22:56:00,"Catholicism,Christmas,Calendar",When is the end of the Christmas season for Latin Rite Catholics?,Peter Turner,13
1,2016-01-16T14:54:00,"History,Origin,Fall Of Man,Adam",Who was the first to reject the historicity of Adam?,curiousdannii,13
2,2016-01-20T18:45:00,"Catholicism,Marriage,Canon Law,Bishops",Can Bishops give dispensations from certain marriage vows?,Peter Turner,13
2,2011-11-25T21:36:00,"Terminology,Reformed Theology,Covenants,Covenant Theology",What is the difference between a covenant and a contract?,Caleb,13
1,2015-07-30T22:36:00,"Nature Of God,Protestantism,Terminology,Omniprescence,Panentheism",How widespread is panentheism within Protestant schools of thought?,Mr. Bultitude,13
1,2015-08-04T20:29:00,"Adam And Eve,Fall Of Man,Art,Christian Literature,John Milton","Do any theologians argue that in the Fall, Adam sacrificed himself out of love for Eve?",Nathaniel is protesting,13
1,2015-08-14T13:05:00,"Exegesis,Gospel Of Luke,Suffering,2 Timothy,Passion Of Jesus",Why was Jesus afraid/agonizing in the Garden of Gethsemane if the Spirit of God isn't one of fear but of power?,LCIII,13
2,2015-08-25T12:58:00,"Catholicism,Marriage,Virgin Mary,Joseph Husband Of Mary,Perpetual Virginity","According to Catholic teaching, was Joseph and Mary's marriage a true marriage?",An old man in the sea.,13
2,2015-08-27T00:12:00,"Jehovahs Witnesses,Symbolism,Sign Of The Cross","Why did this Early Version of the Watchtower Magazine include Crosses, and what do these other Symbols on the Magazine Represent?",The Substitute,13
4,2015-10-02T22:10:00,"Exegesis,Paul Apostle,Acts,Apostles,Matthias",What is the basis for arguing that Paul should have been selected as the 12th apostle instead of Matthias?,Nathaniel is protesting,13
3,2015-10-03T08:20:00,"Biblical Basis,Church History,Satan,Hell,Origin",What is the origin of the belief that Satan tortures the unsaved in Hell?,,13
3,2011-11-03T17:38:00,"Bible,Canon",How many distinct Biblical canons are there?,Chelonian,13
2,2011-11-07T18:25:00,"Catholicism,Papacy,Peter,Papal Infallibility,Galatians",How does the doctrine of Papal Infallibility account for Peter's error?,Narnian,13
2,2015-12-12T05:33:00,"Nature Of God,Reformed Theology,Glory,Purpose",Why must God reach the fullness of Glory (reformed theology)?,,13
1,2016-01-07T15:08:00,"Bible,Old Testament,Gospels",In which one of the four Gospels is the Old Testament quoted the most?,brilliant,13
1,2016-01-13T07:16:00,"Science,Young Earth Creation",How do young earth creationists explain the evidence for ice ages?,Petersolomon,13
3,2015-04-03T04:58:00,"Abraham,Israel",Why is the Nation of Israel called Israel and not Abraham?,,13
3,2011-10-10T12:56:00,"Bible Translation,Esv,Nasb",What are the differences between the translation ideologies of the NASB and ESV?,StackExchange saddens dancek,13
2,2015-05-22T23:20:00,"Soteriology,Origin,Phrase,Penal Substitution","When and where does the statement, ""Christ paid the penalty for our sins"" first appear?",Lee Woofenden,13
2,2015-05-24T07:11:00,"Old Testament,Inerrancy,Textual Criticism,Providence",How are emendations to the Masoretic Text viewed within the doctrine of inerrancy?,Susan,13
2,2015-05-31T23:47:00,"Catholicism,Marriage,Divorce,Monasticism",Are Catholics allowed to leave marriage in order to become a monk or nun?,Karel Macek,13
1,2011-10-14T02:22:00,"Catholicism,Tetragrammaton",Should Catholics silently hum the Tetragrammaton when they're supposed to sing it?',Peter Turner,13
3,2011-09-30T18:24:00,Catholicism,Where can I learn about Catholic terms and phrases?,Flimzy,13
3,2011-09-30T20:36:00,"Politics,Israel",If I am a Christian does this mean I need to support the modern state of Israel?,aceinthehole,13
2,2015-02-13T02:56:00,Christology,What is the difference between Apollinarianism and Eutychianism?,Adithia Kusno,13
1,2015-02-16T22:32:00,"Crucifixion,Culture",Where does the story of the spider on the cross come from?,John Loughrey,13
2,2011-10-02T19:59:00,Genesis,Who is Lillith?,TRiG,13
3,2011-10-03T22:37:00,"Heaven,Afterlife",What is life in Heaven going to be like?,,13
4,2011-10-04T23:41:00,"Biblical Basis,Nature Of Man",Can a Christian have clinical depression?,StackExchange saddens dancek,13
1,2011-10-05T13:39:00,"Bible,Prophecy,Christology",Did the Romans not breaking Jesus' legs fulfill a prophecy?,wax eagle,13
1,2015-07-17T03:44:00,"Church History,Christology,Hell,Apostles Creed,Place Of The Dead","When did ""he descended into hell"" become part of the Apostles' Creed?",Nathaniel is protesting,13
4,2011-09-28T02:12:00,"Life Of Jesus,Gospel Of John,Infallibility","Was 'Jesus and the woman taken in adultery' in St. John a later addition, and does this invalidate infallibility?",aceinthehole,13
6,2011-09-28T03:22:00,"Life Of Jesus,Marriage",Could Jesus have been married?,beatgammit,13
5,2014-12-08T03:20:00,"Biblical Basis,Homosexuality",What is the Biblical argument that homosexual attraction is sinful by itself?,Ryan,13
4,2014-12-24T00:24:00,"Catholicism,Communion,Sacraments,Lutheranism,Transubstantiation",What is the Lutheran doctrine of consubstantiation and how does it differ from transubstantiation and a more general protestant sacramental view?,Ben Mordecai,13
